{"memory_route":"required","state_refs":["state-synthetic"],"governing":{"system":"cog-synthetic-governing","kernel_version":"1","modules":["cog-synthetic-module"]},"frameworks":{"primary":"cog-synthetic-method","secondary":null},"retrieval_plan":[{"layer":"semantic","method":"direct_get","target":"sem-synthetic-preference","query":null,"purpose":"resolve current synthetic preference"}],"confidence":0.9,"reason_codes":["CURRENT_CONTEXT_INSUFFICIENT"]}
